source,country,query,title,company,location,salary_min,salary_max,description,created,scraped_at,country_name,skills,salary_avg
adzuna,nl,javascript developer,"Lead Full stack developer (Ruby on Rails, JavaScript)",SuperSaas,"Amsterdam, Noord-Holland",,,"We aim to provide the very best appointment scheduling software, so we are looking for someone who is at the top of their field and writes DRY, elegant code. We consider top tier coding an art form and treat programmers with the respect they deserve. Software runs through our veins: the founder of our company is also a developer and still commits regularly. SuperSaaS looks for candidates who enjoy working for a rapidly growing company and are passionate about creating great software using cutti…",2025-06-24 08:06:24+00:00,2025-06-30 19:53:58.703212,Netherlands,['JavaScript'],
adzuna,nl,javascript developer,".NET Software Engineer, .NET 8, C# - Record Label - The Hague",Noir,"Den Haag, Zuid-Holland",60000.0,84000.0,".NET Software Engineer, .NET 8, C# - Global Record Label - The Hague, Netherlands (Tech stack: .NET Software Engineer, .NET 8, C#, Azure, Angular 17, Multithreading, RESTful, Web API 2, JavaScript, Programmer, Full Stack Developer, Architect, .NET Software Engineer) We are pleased to announce that our client, one of the largest and most recognised brands within the music industry, is seeking .NET Software Engineer to work out of their plush offices in the heart of The Hague, Netherlands. You wi…",2025-06-24 09:54:03+00:00,2025-06-30 19:53:58.703215,Netherlands,[],72000.0
adzuna,nl,javascript developer,Back-end Developer,Jelling,"Vught, Noord-Brabant",,,"Max € 4.500,- | 32 - 40 uur | Typescript / Javascript | Back-end Developer | Regio Den Bosch | Functieomschrijving Voor een bedrijf in de regio van Den Bosch zoek ik een ervaren Back-end Developer. Jij gaat de interne software verder door ontwikkelen en gaat ook nieuwe maatwerk software bouwen. Je werkt met REST API's en Typescript. Dit worden jouw taken: Ontwerpen en implementeren van software met Typescript en Node.js; Onderhouden van (REST) API's; Uitvoeren van performance optimalisaties; We…",2025-06-23 16:04:12+00:00,2025-06-30 19:53:58.703218,Netherlands,[],
adzuna,nl,javascript developer,Software Developer,Jelling,Nederland,,,"Max € 4.500,- | 32 - 40 uur | Typescript / Javascript | Back-end Developer | Regio Den Bosch | Functieomschrijving Wij zijn op zoek naar een ervaren Back-end Developer voor een bedrijf gevestigd in de regio van Den Bosch. In deze rol zul je verantwoordelijk zijn voor het verder ontwikkelen van interne software en het bouwen van nieuwe maatwerk software. Je zult werken met REST API's en Typescript. Jouw taken zullen onder meer zijn: Het ontwerpen en implementeren van software met behulp van Type…",2025-06-25 11:38:54+00:00,2025-06-30 19:53:58.703221,Netherlands,[],
adzuna,nl,javascript developer,Back-end Developer,Jelling,"Vught, Noord-Brabant",,,"Max € 4.500,- | Typescript / Javascript | Back-end Developer | Regio Den Bosch | Functieomschrijving Voor een bedrijf in de regio van Den Bosch zoek ik een ervaren Back-end Developer. Jij gaat de interne software verder door ontwikkelen en gaat ook nieuwe maatwerk software bouwen. Je werkt met REST API's en Typescript. Dit worden jouw taken: Ontwerpen en implementeren van software met Typescript en Node.js; Onderhouden van (REST) API's; Uitvoeren van performance optimalisaties; Werken met TDD e…",2025-06-27 06:42:25+00:00,2025-06-30 19:53:58.703225,Netherlands,[],
adzuna,nl,javascript developer,.NET Software Engineer - Growing Internet Company - Eindhoven,Noir,Nederland,60000.0,72000.0,".NET Software Engineer - Fastest-Growing Internet Co Ever - Eindhoven, Netherlands (Tech stack: .NET Software Engineer, .NET 8, C#, Azure, Angular 17, Multithreading, RESTful, Web API 2, JavaScript, Programmer, Full Stack Developer, Architect, Ontwikkelaar, .NET Software Engineer) Our client is changing the way merchants and consumers connect with each other worldwide, and the change has barely started. In 2023, they were the fastest-growing internet company ever, and they drove more than €4 bi…",2025-06-24 09:54:03+00:00,2025-06-30 19:53:58.703228,Netherlands,[],66000.0
adzuna,nl,javascript developer,PHP developer,Bold Company,Nederland,,,"Wij zoeken een PHP Developer die volledig zelfstandig zijn bijdragen kan leveren aan het ontwikkelen van onderwijs tools. Net zoals onze developers op kantoor word jij enthousiast van SaaS-software die altijd functioneert. Je maakt samen met een klein team innovatieve producten, dit betekend dat je sterk op elkaar aangewezen bent en een echte teamspeler ben. Jouw werkzaamheden zullen voornamelijk bestaan uit het bouwen van nieuwe functionaliteiten , gebruiksvriendelijkheid en API-koppelingen . …",2025-06-19 04:41:31+00:00,2025-06-30 19:53:58.703231,Netherlands,[],
adzuna,nl,javascript developer,".NET Software Engineer - Amsterdam, Netherlands",Noir,"Amsterdam, Noord-Holland",60000.0,84000.0,".NET Software Engineer - Amsterdam, Netherlands (Tech stack: .NET Software Engineer, .NET 8, C#, Azure, Angular 17, Multithreading, RESTful, Web API 2, JavaScript, Programmer, Full Stack Developer, Architect, Ontwikkelaar, .NET Software Engineer) After 15 years' experience in the fashion industry, our client has a mission to change the way people find clothes they love by combining technology with the personal touch of seasoned style experts. Our client is not merely concerned with supplying cl…",2025-06-24 09:54:03+00:00,2025-06-30 19:53:58.703234,Netherlands,[],72000.0
adzuna,nl,javascript developer,".NET Software Engineer, .NET 8, C#, Agile - Almere",Noir,"Almere, Flevoland",72000.0,96000.0,".NET Software Engineer, .NET 8, C#, Agile - Almere, Netherlands (Tech stack: .NET Software Engineer, .NET 8, C#, Azure, Angular 17, Multithreading, RESTful, Web API 2, JavaScript, Programmer, Full Stack Developer, Architect, .NET Software Engineer) Our client is a global innovator who builds software products and apps that are defining the way individuals and teams work today. They make it easy for users and to achieve their personal and professional goals and to ultimately be 'a better you' at…",2025-06-24 09:54:03+00:00,2025-06-30 19:53:58.703237,Netherlands,[],84000.0
adzuna,nl,javascript developer,Frontend Developer - Eindhoven,Noir,Nederland,45000.0,66000.0,"Frontend Developer - Global Internet Icon - Eindhoven, Netherlands (Tech stack: Frontend Developer, HTML, CSS, TypeScript, JavaScript, jQuery, React, VueJS, Web, UI, UX, User Interface, User Experience, Front End, Frontend Developer) Our client, a longstanding internet icon that has evolved into a diversified modern media company, is embarking on one of the most ambitious projects since the inception of the World Wide Web. We are actively seeking a Frontend Developer to join this exciting ventu…",2025-06-24 09:54:03+00:00,2025-06-30 19:53:58.703241,Netherlands,[],55500.0
adzuna,nl,javascript developer,Front-end developer | Fulfillment,Haystack People,Nederland,,,"Wil jij als front-ender werken aan de software die voorafgaat aan de meeste pakketjes die jij online besteld? Lees dan verder! Wat doen ze? Onze klant is een toonaangevende speler in de logistieke e-commerce markt en helpt bedrijven met het volledig ontzorgen van hun logistiek. Het in-house ontwikkelde platform speelt hierbij een cruciale rol. Onze klant gelooft in een open bedrijfscultuur waarin innovatie, samenwerking en ontwikkeling centraal staan. Al meer dan 20 jaar is onze klant actief bi…",2025-05-11 09:53:37+00:00,2025-06-30 19:53:58.703244,Netherlands,[],
adzuna,nl,javascript developer,Frontend Developer - Rotterdam,Noir,"Rotterdam, Zuid-Holland",60000.0,84000.0,"Frontend Developer - Social Messaging Platform - Rotterdam, Netherlands (Tech stack: Frontend Developer, HTML, CSS, TypeScript, JavaScript, Angular, React, VueJS, jQuery, Web, UI, UX, User Interface, User Experience, Front End, Frontend Developer) In 2012, our client launched a social messaging platform that has been making waves in the US. Following a period of remarkable success, the company has decided to extend its reach across the Atlantic, aiming to establish a strong presence in the UK a…",2025-06-24 09:54:03+00:00,2025-06-30 19:53:58.703247,Netherlands,[],72000.0
adzuna,nl,javascript developer,.NET Software Engineer - Global Phenomenon - Amsterdam,Noir,"Amsterdam, Noord-Holland",48000.0,72000.0,".NET Software Engineer - Global Phenomenon - Amsterdam, Netherlands (Tech stack: .NET Software Engineer, .NET 8, C#, Azure, Angular 17, Multithreading, RESTful, Web API 2, JavaScript, Programmer, Full Stack Developer, Architect, Ontwikkelaar, .NET Software Engineer) Our client has created a global phenomenon, connecting people online to unique travel experiences, in more than 60,000 cities and 180 countries. As they approach their 10th anniversary they are looking to produce a revolutionary set…",2025-06-24 09:54:03+00:00,2025-06-30 19:53:58.703250,Netherlands,[],60000.0
adzuna,nl,javascript developer,Software Ontwikkelaar,Jelling,"Helmond, Noord-Brabant",,,"€ 4.500,- | Software Developer | Flexibele werktijden | Javascript | Solliciteer snel. Functieomschrijving Ben je op zoek naar een nieuwe werkomgeving waar je aanzienlijke vrijheid hebt en ook inspraak hebt in de software en processen? Dit is jouw kans! Je zult aan de slag gaan in de rol van Fullstack Developer en zowel bestaande interne software verder ontwikkelen als nieuwe softwareconcepten bedenken en bouwen. Je bent een waardevol lid van een team van fullstack developers die een grote pass…",2025-06-27 08:15:27+00:00,2025-06-30 19:53:58.703254,Netherlands,[],
adzuna,nl,javascript developer,Asset & Wealth Management - Front End Engineer - Analyst - The Hague,Goldman Sachs,Nederland,,,"Description GSAM is the asset management arm of Goldman Sachs, which supervises more than $1.8 trillion in assets. Goldman Sachs Asset Management has been providing discretionary investment advisory services since 1988 and has investment professionals in all major financial centers around the world. Our team of engineers builds solutions to the most complex problems. We develop cutting-edge digital platform and processes that form the core of our key business and enable several marketing and sa…",2025-05-16 11:38:22+00:00,2025-06-30 19:53:58.703257,Netherlands,[],
adzuna,nl,javascript developer,Developer Support Specialist,Telnyx,Nederland,,,"About Telnyx Telnyx is an industry leader that's not just imagining the future of global connectivity—we're building it. From architecting and amplifying the reach of a private, global, multi-cloud IP network , to bringing hyperlocal edge technology right to your fingertips through intuitive APIs, we're shaping a new era of seamless interconnection between people, devices, and applications. We're driven by a desire to transform and modernize what's antiquated, automate the manual, and solve rea…",2025-05-30 11:40:39+00:00,2025-06-30 19:53:58.703260,Netherlands,[],
adzuna,nl,javascript developer,Full Stack Web Developer,Top Employers Institute,"Binnenstad, Amsterdam",,,"Full Stack Web Developer Top Employers Institute is the 1 global authority on HR strategies. With our world leading Certification and data-led insights, we guide and empower organisations in delivering transformational people practices, driving business outcomes and helping them attract, engage and retain top talent. Established more than 30 years ago and operating in 125 countries worldwide, Top Employers Institute collaborates with 2,400 companies, including some of the world's most reputable…",2025-05-25 11:39:17+00:00,2025-06-30 19:53:58.703263,Netherlands,[],
adzuna,nl,react developer,Senior React Developer,Thinkwise,Nederland,,,"Break the monotony and code the future with us! Functieomschrijving Als React Developer ontwikkel je samen met het Front-end team mee aan het Thinkwise Platform. Je werkt samen met het Back- end en Meta-model team aan het opleveren en optimaliseren van complete platform features die door duizenden gebruikers worden gebruikt. Het Front-end team ontwikkelt met behulp van de nieuwste technieken een abstracte cross-platform GUI voor zowel desktop, web als mobiel. Op run-time niveau interpreteert de…",2025-06-21 04:55:05+00:00,2025-06-30 19:54:01.421225,Netherlands,['React'],
adzuna,nl,react developer,Senior Frontend React Developer,NS,"Utrecht, Provincie Utrecht",,,Transformeer treinplanning met Maple als Senior Frontend Developer bij NS! Bouw innovatieve oplossingen in React en beïnvloed duurzaam reiscomfort. Deel je expertise en werk aan uitdagende visualisaties! Daarom wil je als Senior frontend developer bij NS werken Bouwen aan de complexe logistieke puzzels binnen het spoordomein. Maak met jouw team de transitie naar DevOps. Werk aan een duurzame samenleving waarin treinvervoer vanuit milieuoogpunt en door verstedelijking steeds belangrijker wordt. …,2025-06-26 11:05:09+00:00,2025-06-30 19:54:01.421241,Netherlands,['React'],
adzuna,nl,react developer,Interim React developer (detachering),Morgan Black,Nederland,,,Functieomschrijving Morgan Black is voor een van haar goede klanten per direct op zoek naar een Front-end React developer. Jij zal gaan helpen met enkele applicaties naar een hoger niveau te tillen Functie eisen Minimaal 5 jaar werkervaring als als Front-end Engineer HBO of WO werk/denkniveau; Specialist in: React en Typescript Beheerst de Nederlandse taal zowel in woord als in geschrift. Bedrijfsprofiel & Cultuur Onze klant is een grote organisatie die graag blijft innoveren. Ze zijn bezig met…,2025-06-19 04:41:30+00:00,2025-06-30 19:54:01.421245,Netherlands,['React'],
adzuna,nl,react developer,React Developer,OfferZen,"Utrecht, Provincie Utrecht",,,"React Developer Are you an EU citizen looking for the next big move in your developer career? OfferZen companies across Europe are hiring React Developers. Companies on OfferZen are looking for React Developers with strong technical skills to produce visual interfaces of web applications, and develop new user-facing features. Requirements: 2 years experience working as a Frontend Developer Experience working with React Experience working in an English speaking environment Experience working wit…",2022-11-30 15:03:43+00:00,2025-06-30 19:54:01.421248,Netherlands,['React'],
adzuna,nl,react developer,React Developer,OfferZen,"Delft, Zuid-Holland",,,"React Developer Are you an EU citizen looking for the next big move in your developer career? OfferZen companies across Europe are hiring React Developers. Companies on OfferZen are looking for React Developers with strong technical skills to produce visual interfaces of web applications, and develop new user-facing features. Requirements: 2 years experience working as a Frontend Developer Experience working with React Experience working in an English speaking environment Experience working wit…",2023-02-16 14:35:20+00:00,2025-06-30 19:54:01.421251,Netherlands,['React'],
adzuna,nl,react developer,React Developer,OfferZen,"Amsterdam, Noord-Holland",,,"React Developer Are you an EU citizen looking for the next big move in your developer career? OfferZen companies across Europe are hiring React Developers. Companies on OfferZen are looking for React Developers with strong technical skills to produce visual interfaces of web applications, and develop new user-facing features. Requirements: 2 years experience working as a Frontend Developer Experience working with React Experience working in an English speaking environment Experience working wit…",2023-06-03 19:10:08+00:00,2025-06-30 19:54:01.421255,Netherlands,['React'],
adzuna,nl,react developer,React Developer,OfferZen,"Den Haag, Zuid-Holland",,,"React Developer Are you an EU citizen looking for the next big move in your developer career? OfferZen companies across Europe are hiring React Developers. Companies on OfferZen are looking for React Developers with strong technical skills to produce visual interfaces of web applications, and develop new user-facing features. Requirements: 2 years experience working as a Frontend Developer Experience working with React Experience working in an English speaking environment Experience working wit…",2023-02-16 14:35:23+00:00,2025-06-30 19:54:01.421258,Netherlands,['React'],
adzuna,nl,react developer,React Developer,OfferZen,"Eindhoven, Noord-Brabant",,,"React Developer Are you an EU citizen looking for the next big move in your developer career? OfferZen companies across Europe are hiring React Developers. Companies on OfferZen are looking for React Developers with strong technical skills to produce visual interfaces of web applications, and develop new user-facing features. Requirements: 2 years experience working as a Frontend Developer Experience working with React Experience working in an English speaking environment Experience working wit…",2023-02-16 14:35:22+00:00,2025-06-30 19:54:01.421261,Netherlands,['React'],
adzuna,nl,react developer,React Developer,OfferZen,"Rotterdam, Zuid-Holland",,,"React Developer Are you an EU citizen looking for the next big move in your developer career? OfferZen companies across Europe are hiring React Developers. Companies on OfferZen are looking for React Developers with strong technical skills to produce visual interfaces of web applications, and develop new user-facing features. Requirements: 2 years experience working as a Frontend Developer Experience working with React Experience working in an English speaking environment Experience working wit…",2022-11-30 15:03:40+00:00,2025-06-30 19:54:01.421264,Netherlands,['React'],
adzuna,nl,react developer,React Developer,F2F.com,"Amsterdam, Noord-Holland",,,"(Dutch residents only) As a React-developer you will become part of an ambitious team that aims to develop the best fan engagement platform in the world. We do this for creators and their fans. Jouw rol We offer creators the most user-friendly platform to connect and maintain with their fans and make money from it. The team realizes that hundreds of thousands of users rely on fast and high-quality video streaming, various flexible subscription payment options and pay-to-unlock content. For many…",2025-06-18 08:06:21+00:00,2025-06-30 19:54:01.421267,Netherlands,['React'],
adzuna,nl,react developer,React Developer,Jelling,"Waalre, Noord-Brabant",,,"Max € 4.500,- | 32 tot 40 uur | Back-end Developer | REACT | Interne functie | Reageer direct! Functieomschrijving Ben jij een ambitieuze developer die energie krijgt van maatwerkoplossingen en het bouwen van slimme digitale tools? In deze rol werk je binnen een hecht team aan het ontwikkelen en optimaliseren van zowel web- als mobiele applicaties. Je houdt je bezig met het bouwen van stabiele back-end oplossingen en het opzetten van API-koppelingen die interne processen versnellen en verbetere…",2025-06-28 07:31:21+00:00,2025-06-30 19:54:01.421270,Netherlands,['React'],
adzuna,nl,react developer,React Native Developer,New Black,Nederland,,,"Welcome to New Black! We are seeking an experienced Senior React Native Developer to take a leading role in an exciting mission. As a key member of our team, you will drive the evolution of the web and mobile experience within EVA, our unified commerce platform. Your expertise will empower globally recognized brands and retailers to deliver a seamless, highly adaptable, and premium shopping experience across all digital touchpoints. You’ll collaborate closely with cross-functional teams, mentor…",2025-06-04 08:03:20+00:00,2025-06-30 19:54:01.421273,Netherlands,['React'],
adzuna,nl,react developer,Senior react developer,IT-idiots®,Nederland,78000.0,78000.0,"Senior React Developer gezocht! Voor een opdrachtgever zijn we op zoek naar een ervaren Senior React Developer die ons team Webontwikkeling komt versterken. Je werkt binnen een scrumteam bestaande uit drie developers, een UX-designer, een tester, een functioneel beheerder, een scrum master en een product owner. Dit team is een dynamische mix van zowel ervaren als nieuwe collega’s, en jij brengt met jouw senioriteit een waardevolle aanvulling. Jij bent iemand die écht impact wil maken. Je deelt …",2025-06-02 05:12:04+00:00,2025-06-30 19:54:01.421277,Netherlands,['React'],78000.0
adzuna,nl,react developer,Senior React Developer,OfferZen,"Utrecht, Provincie Utrecht",,,"Senior React Developer Are you an EU citizen looking for the next big move in your developer career? OfferZen companies across Europe are hiring React Developers. Companies on OfferZen are looking for React Developers with strong technical skills to produce visual interfaces of web applications, and develop new user-facing features. Requirements: 6 years experience working as a Frontend Developer Experience working with React Experience working in an English speaking environment Experience work…",2022-11-30 15:03:43+00:00,2025-06-30 19:54:01.421280,Netherlands,['React'],
adzuna,nl,react developer,Senior React Developer,OfferZen,"Delft, Zuid-Holland",,,"Senior React Developer Are you an EU citizen looking for the next big move in your developer career? OfferZen companies across Europe are hiring React Developers. Companies on OfferZen are looking for React Developers with strong technical skills to produce visual interfaces of web applications, and develop new user-facing features. Requirements: 6 years experience working as a Frontend Developer Experience working with React Experience working in an English speaking environment Experience work…",2023-02-16 14:35:20+00:00,2025-06-30 19:54:01.421283,Netherlands,['React'],
adzuna,nl,react developer,Junior React Developer,OfferZen,"Utrecht, Provincie Utrecht",,,"Junior React Developer Are you an EU citizen looking for the next big move in your developer career? OfferZen companies across Europe are hiring React Developers. Companies on OfferZen are looking for React Developers with strong technical skills to produce visual interfaces of web applications, and develop new user-facing features. Requirements: 1 years experience working as a Frontend Developer Experience working with React Experience working in an English speaking environment Experience work…",2022-11-30 15:03:43+00:00,2025-06-30 19:54:01.421286,Netherlands,['React'],
adzuna,nl,react developer,Intermediate React Developer,OfferZen,"Eindhoven, Noord-Brabant",,,"Intermediate React Developer Are you an EU citizen looking for the next big move in your developer career? OfferZen companies across Europe are hiring React Developers. Companies on OfferZen are looking for React Developers with strong technical skills to produce visual interfaces of web applications, and develop new user-facing features. Requirements: 2 years experience working as a Frontend Developer Experience working with React Experience working in an English speaking environment Experienc…",2023-02-16 14:35:22+00:00,2025-06-30 19:54:01.421290,Netherlands,['React'],
adzuna,nl,react developer,Intermediate React Developer,OfferZen,"Rotterdam, Zuid-Holland",,,"Intermediate React Developer Are you an EU citizen looking for the next big move in your developer career? OfferZen companies across Europe are hiring React Developers. Companies on OfferZen are looking for React Developers with strong technical skills to produce visual interfaces of web applications, and develop new user-facing features. Requirements: 2 years experience working as a Frontend Developer Experience working with React Experience working in an English speaking environment Experienc…",2022-11-30 15:03:41+00:00,2025-06-30 19:54:01.421293,Netherlands,['React'],
adzuna,nl,react developer,Intermediate React Developer,OfferZen,"Utrecht, Provincie Utrecht",,,"Intermediate React Developer Are you an EU citizen looking for the next big move in your developer career? OfferZen companies across Europe are hiring React Developers. Companies on OfferZen are looking for React Developers with strong technical skills to produce visual interfaces of web applications, and develop new user-facing features. Requirements: 2 years experience working as a Frontend Developer Experience working with React Experience working in an English speaking environment Experienc…",2022-11-30 15:03:43+00:00,2025-06-30 19:54:01.421300,Netherlands,['React'],
adzuna,nl,react developer,Junior React Developer,OfferZen,"Amsterdam, Noord-Holland",,,"Junior React Developer Are you an EU citizen looking for the next big move in your developer career? OfferZen companies across Europe are hiring React Developers. Companies on OfferZen are looking for React Developers with strong technical skills to produce visual interfaces of web applications, and develop new user-facing features. Requirements: 1 years experience working as a Frontend Developer Experience working with React Experience working in an English speaking environment Experience work…",2023-06-03 19:10:08+00:00,2025-06-30 19:54:01.421304,Netherlands,['React'],
adzuna,nl,react developer,Junior React Developer,OfferZen,"Den Haag, Zuid-Holland",,,"Junior React Developer Are you an EU citizen looking for the next big move in your developer career? OfferZen companies across Europe are hiring React Developers. Companies on OfferZen are looking for React Developers with strong technical skills to produce visual interfaces of web applications, and develop new user-facing features. Requirements: 1 years experience working as a Frontend Developer Experience working with React Experience working in an English speaking environment Experience work…",2023-02-16 14:35:23+00:00,2025-06-30 19:54:01.421308,Netherlands,['React'],
