source,country,query,title,company,location,salary_min,salary_max,description,created,scraped_at,country_name,skills,salary_avg
adzuna,fr,python developer,Confirmed Python Developer (F/M),Veesion,"Paris, Ile-de-France",,,"Veesion is experiencing rapid growth following its successful Series B funding round. This expansion phase requires strengthening our technical foundation and scaling our development capabilities to meet increasing market demands. As we structure our growing team, we're seeking a Confirmed Python Developer to play a pivotal role in a dynamic environment where they can make a significant impact on both our technology stack and team culture during this exciting growth phase. Reporting to the Head…",2025-06-25 05:24:32+00:00,2025-06-30 19:53:40.919948,France,['Python'],
adzuna,fr,python developer,Python Developer,Starcom consulting limited,France,15.0,22.0,"who speaks well in French ( Any European Country) Contract Duration : 12 Months Experience : 7 yr Rate : Euro 22/hr Any specific skills set other than the JD that Hiring manager is looking for i.e. python frameworks : Python, Large Language Models (LLM). API Design,Django Python Developer Any European Country Remote A well funded AI research and development company is looking for a Python developer to join our dynamic and growing team. The ideal candidate should have a strong background in API …",2025-06-06 17:29:56+00:00,2025-06-30 19:53:40.919965,France,['Python'],18.5
adzuna,fr,python developer,Sr Python - Backend Developer,Monk AI,"Paris, Ile-de-France",,,"About the Company Monk provides visual expertise through Computer Vision and Deep Learning algorithms. Today, our AI model is able to detect and classify damage on any type of vehicle, from photos taken on a smartphone. The company is already working with international leading players, such as our parent company ACV Auctions (USA), but also CAT logistics (Europe) Getaround (France), Autobiz (Europe) or Hgreg (Canada). We are building a word-class damage detection and computer vision service. We…",2025-06-25 05:24:28+00:00,2025-06-30 19:53:40.919970,France,['Python'],
adzuna,fr,python developer,Python Developer,Corsearch,"10ème Arrondissement, Paris",,,"✅The Role As a Python Developer you’ll play a crucial role in advancing our shared mission of protecting and enhancing the world’s most valuable brands. Collaborating with Corsearch’s global team of engineers, and brand protection experts, you’ll help drive innovation in brand protection and online content monitoring , ensuring our clients stay ahead in a rapidly evolving digital landscape. ✅Responsibilities and Duties Develop and implement new features: Work on adding new functionalities to en…",2024-12-26 00:45:17+00:00,2025-06-30 19:53:40.919974,France,['Python'],
adzuna,fr,python developer,LEAD DEVELOPER PYTHON,Harnham,"Paris, Ile-de-France",,,"LEAD DEVELOPER PYTHON PARIS (75) 70-90K€ Cette société innovante en pleine croissance, développe une solution à fort impact. Leur produit phare, une application mobile utilisée directement par les clients finaux, est en pleine structuration technique. VOTRE RÔLE Revue de code, définition et amélioration des process backend Animation technique de l'équipe backend (sans responsabilités RH) Encadrement opérationnel de trois développeurs backend Contribution aux choix d'architecture technique en li…",2025-06-08 10:05:17+00:00,2025-06-30 19:53:40.919978,France,['Python'],
adzuna,fr,python developer,Senior Python Developer,Lengow,"Nantes, Loire-Atlantique",40.0,65.0,"Lengow is a leader in intelligent e-commerce solutions that help brands and retailers drive profitable growth across the digital shelf. With powerful feed management, global price monitoring, and robust data capabilities, Lengow’s comprehensive SaaS product suite enables merchants to amplify product visibility online, outrun competition with informed pricing, multiply sales on marketplaces, and monitor brand presence among distributors. Since 2009, Lengow has fueled digital growth for over 3,60…",2025-05-23 12:02:08+00:00,2025-06-30 19:53:40.919982,France,['Python'],52.5
adzuna,fr,python developer,Lead Python Developer,Payplug,"Paris, Ile-de-France",,,"Payplug est la solution de paiement française pensée pour les commerçants, e-commerçants de toutes tailles et fintechs. Avec notre plateforme technologique de pointe, nos outils dédiés à la conversion et notre maîtrise unique de la chaîne de paiement, nous vous invitons à viser le meilleur, et plus encore. Payplug, c’est une équipe de 350 passionnés dédiés à la réalisation de vos plus grandes ambitions. Nous accompagnons aujourd’hui 17 000 PME telles que Hast et Plantes pour tous, mais aussi de…",2025-02-05 17:15:22+00:00,2025-06-30 19:53:40.920192,France,['Python'],
adzuna,fr,python developer,Quantitative Developer- Python,NJF Global Holdings Ltd,"Paris, Ile-de-France",,,"Quantitative Developer – Python A leading global quantitative and systematic investment firm is looking for an experienced Python Quantitative Developer to support its cross-asset systematic trading operations. This is a dynamic, fast-paced role working closely with traders, quants, and engineers to deliver production-quality tools and technology solutions with immediate business impact. Key Responsibilities Collaborate directly with traders and researchers to develop tools that optimize and st…",2025-06-11 04:30:27+00:00,2025-06-30 19:53:40.920208,France,['Python'],
adzuna,fr,python developer,Python Developer - AI Solutions,Schneider Electric,"Grenoble, Isère",,,"Schneider Electric ’s purpose is to empower all to make the most of our energy and resources, bridging progress and sustainability for all. At Schneider, we call this Life Is On . We are driving digital transformation by integrating the most advanced energy and automation technologies. We connect products, control platforms, software and services throughout the lifecycle of our customers' activities to the cloud for integrated management of residential housing, commercial buildings, data center…",2024-07-30 23:47:58+00:00,2025-06-30 19:53:40.920213,France,['Python'],
adzuna,fr,python developer,AI Full Stack Python Developer,Devoteam Initiatives Platform,"Levallois-Perret, Nanterre",,,"Job Description En tant que AI Full Stack Python Developer , vous jouerez un rôle central au sein de nos équipes produit, en concevant et en développant des solutions d’IA générative. Vous serez impliqué·e dès la phase de preuve de concept jusqu’à la mise en production, en adoptant des méthodologies Lean Startup et MVP pour valider rapidement les cas d’usage à fort impact. Vos missions Développement Frontend Conception d’interfaces : Créer des interfaces utilisateurs performantes et intuitives,…",2025-06-20 01:30:17+00:00,2025-06-30 19:53:40.920219,France,['Python'],
adzuna,fr,python developer,Confirmed Python Developer (F/M),Veesion,"8ème Arrondissement, Paris",60000.0,70000.0,"Please apply directly on our website. Veesion is experiencing rapid growth following its successful Series B funding round. This expansion phase requires strengthening our technical foundation and scaling our development capabilities to meet increasing market demands. As we structure our growing team, we’re seeking a Confirmed Python Developer to play a pivotal role in a dynamic environment where they can make a significant impact on both our technology stack and team culture during this exciti…",2025-06-21 22:46:55+00:00,2025-06-30 19:53:40.920225,France,['Python'],65000.0
adzuna,fr,python developer,Confirmed Python Developer (F/M),Veesion,"Paris, Ile-de-France",,,"is experiencing rapid growth following its successful Series B funding round. This expansion phase requires strengthening our technical foundation and scaling our development capabilities to meet increasing market demands. As we structure our growing team, we're seeking a Confirmed Python Developer to play a pivotal role in a dynamic environment where they can make a significant impact on both our technology stack and team culture during this exciting growth phase. Reporting to the Head Of Engi…",2025-06-25 10:53:21+00:00,2025-06-30 19:53:40.920269,France,['Python'],
adzuna,fr,python developer,Senior Python Developer - CDI Toulouse,EasyMile,"Haute-Garonne, Occitanie",,,"We are seeking a skilled and motivated Infrastructure Engineer for a replacement position within our embedded Infrastructure team in Toulouse. As an Infrastructure Engineer, you will play a crucial role in building and maintaining the development environment and frameworks that support our embedded software components: Build and maintain the developer environment for robotics teams (Operating system packaging, CI/CD pipelines, code quality, testing framework, etc.) Build and maintain frameworks…",2025-03-28 20:28:34+00:00,2025-06-30 19:53:40.920274,France,['Python'],
adzuna,fr,python developer,Python Developer - Stage - F/H,Dataleon,"9ème Arrondissement, Paris",,,"Alors que la transition technologique s’accélère, un grand nombre de données est perdu ou n’est pas exploité, faute de gestion ou de moyens humains. C’est pourquoi l’expertise de Dataleon et ses technologies sont mises à profit pour répondre à 3 objectifs : Améliorer l’exploitation des données pour servir la productivité et la performance des entreprises. Générer des modèles (algorithmes) précis et flexibles qui visent à pallier les potentielles erreurs humaines. Mettre à disposition des produi…",2025-06-29 22:17:15+00:00,2025-06-30 19:53:40.920278,France,['Python'],
adzuna,fr,python developer,Python Developer Junior – Commando AI Team,Commando AI Team chez iBanFirst,"Paris, Ile-de-France",,,"Who we are iBanFirst is a fast-growing European fintech that is revolutionizing international payments for SMEs. Founded in 2016, our platform empowers Small & Medium Multinationals (SMMs) to regain control over their payment operations: currency conversion (FX), international transactions, and foreign exchange risk management across 140 countries — quickly, transparently, and securely. We make life easier for SMEs through an advanced technology platform (automation, APIs, AI…) combined with de…",2025-06-19 22:58:19+00:00,2025-06-30 19:53:40.920281,France,['Python'],
adzuna,fr,python developer,Python Developer / DevOps - CDI - F/H,Dataleon,"9ème Arrondissement, Paris",,,"Alors que la transition technologique s’accélère, un grand nombre de données est perdu ou n’est pas exploité, faute de gestion ou de moyens humains. C’est pourquoi l’expertise de Dataleon et ses technologies sont mises à profit pour répondre à 3 objectifs : Améliorer l’exploitation des données pour servir la productivité et la performance des entreprises. Générer des modèles (algorithmes) précis et flexibles qui visent à pallier les potentielles erreurs humaines. Mettre à disposition des produi…",2025-05-05 21:51:00+00:00,2025-06-30 19:53:40.920284,France,['Python'],
adzuna,fr,python developer,Développeur python développement web back (H/F),Systea Infrastructures,"Marseille, Bouches-du-Rhône",,,"SYSTEA est une société spécialisée dans l'emploi de cadres, experts et techniciens spécialisés, présent depuis plus de 10 ans, nous intervenons sur des projets industriels et de grands travaux dans les domaines de l'infrastructure, de l'énergie, de l'aérospatiale, de la défense, des télécommunications, de l'environnement, du BTP, du ferroviaire. Description du poste et Missions Notre cabinet recherche un Développeur Python (H/F) expérimenté pour rejoindre une équipe dynamique. Vous aurez l'oppo…",2024-12-07 04:54:54+00:00,2025-06-30 19:53:40.920287,France,['Python'],
adzuna,fr,python developer,Formation Python - « Développer en langage Python orienté objet » avec formateur en individuel,AWC,"Neuilly-sur-Marne, Le Raincy",,,"À l’issue de la formation, le participant sera en mesure de : Connaître la syntaxe du langage Python - Connaître et manipuler les types de données fondamentaux - Utiliser et définir des fonctions, des modules, des paquets, des exceptions, manipuler des fichiers - Connaître la théorie de la Programmation orientée objet et sa mise en pratique en Python - Connaître et utiliser les modules incontournables de la bibliothèque standard",2025-06-19 02:25:09+00:00,2025-06-30 19:53:40.920295,France,['Python'],
adzuna,fr,python developer,Ingénieur(e) développement Python / GO - Télécoms,Up Technologies,France,,,"Up Technologies est une société de conseil pour l'industrie avec des agences sur Lyon, Grenoble, Aix-en-Provence, Sophia-Antipolis, Toulon et Paris. Nous sommes une société de conseil spécialisée dans les métiers de l' électronique , des systèmes embarqués et de l 'informatique . Nous intervenons en assistance technique ainsi qu' au forfait à travers notre bureau d'études pour fabriquer des cartes électroniques et briques logicielles. Forts d'expériences dans des sociétés de conseil en tant que…",2025-06-27 08:07:01+00:00,2025-06-30 19:53:40.920299,France,['Python'],
adzuna,fr,python developer,Lead developer Python Django F/H,Inside,France,,,"Inside est apporteur de solutions, de services et de valeurs auprès des entreprises et DSI pour une transformation digitale agile. - Ops et infra - Accompagnement et pilotage de projets IT - Transformation DevOps - Digital & Développement - Externalisation IT Inside, c'est aussi une organisation collaborative et apprenante qui favorise la montée en compétences et le partage des savoirs avec ses communautés techniques et nos 2 Centres de Compétences Digital et Infra. Tous nos postes sont accessi…",2025-06-27 08:07:06+00:00,2025-06-30 19:53:40.920302,France,['Python'],
adzuna,fr,python developer,Ingénieur développement C++/Python,Thales,"Vélizy-Villacoublay, Versailles",,,"Construisons ensemble un avenir de confiance Thales est un leader mondial des hautes technologies spécialisé dans trois secteurs d’activité : Défense & Sécurité, Aéronautique & Spatial, et Cyber & Digital. Il développe des produits et solutions qui contribuent à un monde plus sûr, plus respectueux de l’environnement et plus inclusif. Le Groupe investit près de 4 milliards d’euros par an en Recherche & Développement, notamment dans des domaines clés de l’innovation tels que l’IA, la cybersécurit…",2025-06-15 09:33:38+00:00,2025-06-30 19:53:40.920305,France,['Python'],
adzuna,fr,python developer,Lead Developer backend - Python,Fieldbox,"Ile-de-France, France",,,"Our business: We help industrial companies to accelerate their digital transformation and dramatically improve their operational efficiency and competitiveness with data, software and AI. Our clients include CAC 40 companies, as well as small and medium-sized companies on five continents and over 150 industrial sites. What makes us special: We offer a complete range of services, combined by latest technologies, covering the entire lifecycle from ideation, business value assessment, industrializ…",2025-05-18 17:11:08+00:00,2025-06-30 19:53:40.920308,France,['Python'],
adzuna,fr,python developer,Automaticien(ne) - Développement Python H/F,Up Technologies,France,,,"Up Technologies est une société de conseil pour l'industrie avec des agences sur Lyon, Grenoble, Aix-en-Provence, Toulon, Nice Sophia et Paris. Nous sommes une société de conseil spécialisée dans les métiers de l'électronique, des systèmes embarqués et de la mécatronique. Nous intervenons en assistance technique ainsi qu'au forfait à travers notre bureau d'études pour fabriquer des cartes électroniques et briques logicielles. Forts d'expériences dans des sociétés de conseil en tant que Managers…",2025-05-18 17:07:32+00:00,2025-06-30 19:53:40.920311,France,['Python'],
adzuna,fr,python developer,Ingénieur Réseau - Développement Python Crmesh04 H/F,Stormshield,"La-Madeleine, Lille",,,"Acteur européen de référence sur le marché de la cybersécurité et filiale du groupe Airbus, Stormshield se positionne comme le premier éditeur français pure-player en cybersécurité. Notre mission est de concevoir des solutions de sécurité innovantes qui protègent les entreprises notamment les infrastructures critiques et opérationnelle Nous démarrons la réalisation d'une toute nouvelle solution et recherchons des talents pour nous accompagner. Prêt à relever le défi ? Nous recherchons un ou une…",2025-06-28 07:49:44+00:00,2025-06-30 19:53:40.920315,France,['Python'],
adzuna,fr,python developer,214611/Expert technique informatique PYTHON (Développement) - Senior (>8 ans) (IT),WorldWide People,"Saint-Cloud, Boulogne-Billancourt",,,"Expert Technique PYTHON (Développement) - Senior (>8 ans) Expert Technique PYTHON (Développement) - Senior (>8 ans)Dans le cadre du programme IA, nous développons une plateforme basée sur des agents intelligents tel que les agents de type Retrieval-Augmented Generation (RAG), dans un environnement Google Cloud Platform (GCP). Cette plateforme doit permettre aux utilisateurs métiers de créer et de personnaliser des assistants et des workflows utilisant l'IA générative pour améliorer nos processu…",2025-06-18 14:35:48+00:00,2025-06-30 19:53:40.920318,France,['Python'],
adzuna,fr,python developer,214611/Expert technique informatique PYTHON (Développement) - Senior (>8 ans) (IT),WorldWide People,"Saint-Cloud, Boulogne-Billancourt",,,"Expert Technique PYTHON (Développement) - Senior (>8 ans) Dans le cadre du programme IA, nous développons une plateforme basée sur des agents intelligents tel que les agents de type Retrieval-Augmented Generation (RAG), dans un environnement Google Cloud Platform (GCP). Cette plateforme doit permettre aux utilisateurs métiers de créer et de personnaliser des assistants et des workflows utilisant l'IA générative pour améliorer nos processus et systèmes d'information (SI) existants. Le développem…",2025-06-16 02:24:52+00:00,2025-06-30 19:53:40.920321,France,['Python'],
adzuna,fr,python developer,Ingénieur Etudes et Développement Python Salle des Marchés,Algofi,"Paris, Ile-de-France",,,"Au sein d’une banque d'investissements et de financement, en particulier pour le département informatique de la Salle des Marchés Produits Dérivés sur Actions, vous intégrerez l'équipe en charge de l'optimisation des outils de contribution sur divers produits exotiques ainsi que de la conception d’outils tactiques. Cette équipe assure dans un contexte international. le développement, les évolutions et le support des outils développés en langage C++ et en PYTHON. Rôle : En tant que développeur P…",2025-06-05 09:17:21+00:00,2025-06-30 19:53:40.920324,France,['Python'],
adzuna,fr,python developer,Ingénieur Logiciel - Développement Python - contexte scientifique H/F,Forsk,"Toulouse, Haute-Garonne",,,"Missions Membre de notre équipe Développement Produit située à Toulouse, vous participez au développement de nouvelles fonctionnalités de notre produit Naos basé sur une architecture microservice . Dans ce cadre, vos missions sont les suivantes : Interagir avec le Product Owner pour partager une vision claire et détaillée des besoins Développer de nouvelles fonctionnalités sur Backend, majoritairement en Python Analyser et corriger des anomalies sur les fonctionnalités existantes Travailler en …",2025-06-27 07:58:41+00:00,2025-06-30 19:53:40.920330,France,['Python'],
adzuna,fr,python developer,Ingénieur Développement C++ - Python H/F,Externatic,"Pont-Rousseau, Rezé",45000.0,55000.0,"Implantée à Nantes au coeur d'un environnement naturel privilégié, cette entreprise innovante s'impose depuis près de 10 ans comme une pionnière de la transition écologique dans le secteur maritime. Elle conçoit des solutions logicielles de pointe basées sur des expertises en simulation multiphysique, IA, ingénierie logicielle et systèmes embarqués. Dans le cadre de leur croissance, notre cabinet Externatic, partenaire recrutement dédié aux sociétés technologiques en dehors des ESN, accompagne …",2025-05-15 05:36:12+00:00,2025-06-30 19:53:40.920334,France,['Python'],50000.0
adzuna,fr,python developer,Ingénieur Développement C++ - Python H/F,AVISTO,"Fontaine, Grenoble",35000.0,50000.0,Vous êtes intéressé(e) par des projets innovants et souhaitez résoudre des problématiques complexes ? AViSTO souhaite développer son pôle d'expertise IoT en recrutant un(e) ingénieur(e) C++/Python à Grenoble pour intervenir sur différents projets industriels. Vous aurez à charge : - La mise en place d'architectures backend complexes autant fonctionnellement que techniquement - Le développement d'une nouvelle génération de fonctionnalités - Le développement de nouveaux composants réutilisables e…,2025-06-28 07:48:58+00:00,2025-06-30 19:53:40.920337,France,['Python'],42500.0
adzuna,fr,python developer,Quant Developer Python / RUST - Hedge Fund - CDI - 120/180K€ - PARIS,MR SEARCH,"Paris, Ile-de-France",,,"La société : Fond gérant plus 10 milliards dollars. Les 450 collaborateurs sont répartis dans les bureaux en plein centre de Paris ainsi qu’à Londres, Hong Kong et New York. En croissance permanente, la société prône des valeurs fortes tels que l’investissement et l’engagement. Le poste : Votre rôle consiste à fournir des informations de trading quotidiennes. Vous travaillerez avec des traders, des quants et d'autres développeurs quantitatifs pour construire des outils de reporting et d'analyse…",2025-06-13 06:33:17+00:00,2025-06-30 19:53:40.920340,France,['Python'],
adzuna,fr,python developer,"Senior Full Stack Developer - Django, Python, AWS",IC Resources,"Paris, Ile-de-France",,,"My client is a deep-tech start-up developing software in the medical space, combining the latest advances in AI and robotics. Located in Paris, they are backed by some of the world’s largest VC funds and medical professionals relevant to their field. As they continue to scale up, they are looking to hire a further Senior Full Stack Developer who will join the team working on building up their platform. The majority of the role will focus on the backend, however, strong frontend skills are also …",2025-05-24 06:52:55+00:00,2025-06-30 19:53:40.920343,France,['Python'],
adzuna,fr,python developer,Software developer - Golang/Python H/F/N,OVHcloud,"Lille, Nord",,,"OVHcloud Vous voulez contribuer à des projets uniques pour construire ensemble le cloud libre ? Allons-y! Chez OVHcloud, nous sommes animés par la même volonté, celle de construire l’avenir ensemble pour défendre la liberté d’innover. OVHcloud est un acteur mondial et le leader européen du Cloud opérant plus de 450 000 serveurs dans 43 centres de données sur 4 continents à destination de 1,6 million de clients dans plus de 140 pays. Fer de lance d'un Cloud de confiance et pionnier d'un Cloud du…",2025-06-27 08:01:52+00:00,2025-06-30 19:53:40.920346,France,['Python'],
adzuna,fr,python developer,Senior Python Fullstack Developer (Full Remote),Mantra,"2ème Arrondissement, Paris",60000.0,80000.0,"Nous recherchons un software engineer qui nous aidera à protéger efficacement les infrastructures de nos clients. En rejoignant notre équipe, vous : Contriburez à une culture d’ingénierie où la passion pour l’innovation et l’excellence technique est au cœur de tout ce que nous faisons. Travaillerez avec une équipe dynamique pour développer des solutions à la pointe en matière de sécurité. Protégerez les données les plus critiques, en concevant des systèmes sécurisés capables de contrer les mena…",2025-06-22 22:40:59+00:00,2025-06-30 19:53:40.920350,France,['Python'],70000.0
adzuna,fr,python developer,Senior Python Backend Developer (Full Remote),Mantra,"2ème Arrondissement, Paris",,,"Nous recherchons un software engineer qui nous aidera à protéger efficacement les infrastructures de nos clients. En rejoignant notre équipe, vous : Contriburez à une culture d’ingénierie où la passion pour l’innovation et l’excellence technique est au cœur de tout ce que nous faisons. Travaillerez avec une équipe dynamique pour développer des solutions à la pointe en matière de sécurité. Protégerez les données les plus critiques, en concevant des systèmes sécurisés capables de contrer les mena…",2025-06-22 22:51:22+00:00,2025-06-30 19:53:40.920353,France,['Python'],
adzuna,fr,python developer,Intermediate / Senior Backend Developer - App (Python) - CDI,Descartes Underwriting,"Paris, Ile-de-France",,,"ABOUT DESCARTES UNDERWRITING Descartes was born out of the conviction that the ever-increasing complexity of risks faced by corporations, governments and vulnerable communities calls for a renewed approach in insurance. Our team brings together industry veterans from the most renowned institutions (AXA, SCOR, Swiss Re, Marsh, Aon, ) and scientists on top of their field to bring underwriting excellence. After 5 years of existence, Descartes has secured a leading position in parametric insurance …",2025-06-25 06:51:29+00:00,2025-06-30 19:53:40.920356,France,['Python'],
adzuna,fr,python developer,Data Engineer / Developper Python,QuickSign,"2ème Arrondissement, Paris",,,"Le poste est rattaché à l’équipe Data décomposée en 4 équipes : Doc & fraude : développer des microservices pour le traitement de documents et l’identification de comportement frauduleux AI platform : mettre en place des environnements pour l’entraînement et le déploiement de services intégrant de l’IA Data Run : dédié à la gestion de la data plateforme actuelle (maintien en condition, évolution, scaling, etc): reporting financier et BI Data Platform : une équipe dédiée à la refonte de la data …",2025-06-28 23:09:15+00:00,2025-06-30 19:53:40.920359,France,['Python'],
