source,country,query,title,company,location,salary_min,salary_max,description,created,scraped_at,country_name,skills,salary_avg
adzuna,de,python developer,Senior Python Developer with Machine Learning Focus - Remote,dexter health,Deutschland,,," Welcome to dexter health! We are a dynamic healthtech startup dedicated to transforming the healthcare landscape. Our innovative approach focuses on developing cutting-edge tools that directly address the everyday challenges faced by healthcare professionals. At Dexter, our mission is to revolutionize healthcare by automating one billion working hours. Through our AI-based products, we streamline critical tasks such as documentation and duty scheduling (e.g., via voice documentation). This emp…",2025-06-27 22:06:04+00:00,2025-06-30 19:53:48.731266,Germany,['Python'],
adzuna,de,python developer,Stellenangebot Python Developer Daten und Backend (w/m/d) bei Smarketer GmbH,Smarketer,"Charlottenburg, Berlin",,,"Du hast Spaß daran, saubere Datenflüsse und stabile Backends zu entwickeln? Du möchtest mit modernen Technologien arbeiten und eigene Ideen einbringen? Du suchst ein Team, in dem du Verantwortung übernehmen kannst und gemeinsam an smarten, skalierbaren Lösungen gearbeitet wird? Dann freuen wir uns darauf, dich kennenzulernen! Dein Beitrag Als Python Developer (Daten & Backend) entwickelst und optimierst du skalierbare ETL-Prozesse, Datenbanken und Backend-APIs. Du sorgst für eine effiziente Dat…",2025-06-10 14:26:54+00:00,2025-06-30 19:53:48.731269,Germany,['Python'],
adzuna,de,python developer,Senior Python Developer (m/w/d) - 100 % Home Office,Anexia,Deutschland,,,"Anexia ist ein international tätiger Cloud Service Provider sowie Internet Service Provider und wurde im Jahr 2006 von Alexander Windbichler in Klagenfurt, Österreich gegründet. Unser Schwerpunkt liegt auf maßgeschneiderten und hochwertigen Lösungen in den Bereichen Cloud und Managed Services sowie Individualsoftware, App- und Web-Entwicklung. Neben unserem Hauptsitz in Klagenfurt betreiben wir u. a. Büros in Wien, Graz, Karlsruhe sowie New York City. Wir beschäftigen rund 400 Mitarbeiter:innen…",2025-05-14 07:39:08+00:00,2025-06-30 19:53:48.731273,Germany,['Python'],
adzuna,de,python developer,"Développeur senior, Python / Senior Python Software Developer",Cerence Technologies,Deutschland,,,"A Moving Experience. (English version below) Développeur Python Senior Avez-vous une passion pour repousser les limites de l’innovation ? Êtes-vous motivé à créer des expériences plus sûres et plus agréables pour les utilisateurs partout dans le monde ? Alors, rejoignez l’aventure ! Qui est Cerence ? Cerence est le leader mondial de l’intelligence artificielle dans le domaine des transports, spécialisé dans la création de compagnons alimentés par l’IA et la reconnaissance vocale pour les voitur…",2025-01-17 13:13:10+00:00,2025-06-30 19:53:48.731277,Germany,['Python'],
adzuna,de,python developer,Senior Python Backend Developer (m/f/d),CompuGroup Medical,Deutschland,,,"As the leading company in the field of software solutions for healthcare, we operate in 19 countries and employ over 9,000 dedicated staff members. You will work in a dynamic and innovative environment full of opportunities. With your commitment and passion, you have the chance to make a sustainable difference. Together, we are shaping the healthcare system of the future. Become part of our mission and make a difference – for a world where knowledge saves lives! Your contribution: Analyze the e…",2025-06-05 14:43:17+00:00,2025-06-30 19:53:48.731286,Germany,['Python'],
adzuna,de,python developer,Python-Entwickler,automait,"Nordrhein-Westfalen, Deutschland",,,"Stellenbeschreibung: Python Developer (m/w/d) Das Unternehmen: Die automait GmbH bietet ihren Kunden IT-Dienstleistungen und Beratung rund um Daten und künstliche Intelligenz. Zusammen mit einem starken Netzwerk von Partnern bieten wir von der Einführung einer modernen Cloudinfrastruktur bis zu Training und Betrieb von Künstlicher Intelligenz alles an, was Unternehmen brauchen, um künstliche Intelligenz in Produktion zu bringen und dort zu halten. Die Stelle: Wir suchen einen (Senior) Python De…",2025-06-13 09:17:03+00:00,2025-06-30 19:53:48.731316,Germany,['Python'],
adzuna,de,python developer,"Python Software Entwickler (m/w/d) – 20h / Teilzeit, Werkstudent & Remote möglich | API & Automatisierung",Weinkontor Freund GmbH,"Borgholzhausen, Gütersloh (Kreis)",,,"Python Software Entwickler (m⁠/⁠w⁠/⁠d) – 20h / Teilzeit, Werkstudent & Remote möglich | API & Automatisierung Digitalisiere mit uns den Weinhandel! Du brennst für sauberen Code, schlanke APIs und die Automatisierung von Prozessen? Dann komm ins Team der Weinkontor Freund GmbH – einem inhabergeführten Großhandel für Wein & Delikatessen mit einem wachsenden Fokus auf digitale Lösungen. Wir suchen Dich zur Umsetzung unserer Digitalstrategie – in Teilzeit (20 Std./Woche) mit flexiblen Remote-Möglic…",2025-06-21 19:32:19+00:00,2025-06-30 19:53:48.731624,Germany,['Python'],
adzuna,de,python developer,Freelance Software Developer (Python) - AI Trainer,Mindrift,Deutschland,,,"At Mindrift , innovation meets opportunity. We believe in using the power of collective intelligence to ethically shape the future of AI. What we do The Mindrift platform connects specialists with AI projects from major tech innovators. Our mission is to unlock the potential of Generative AI by tapping into real-world expertise from across the globe. About the Role GenAI models are improving very quickly, and one of our goals is to make them capable of addressing specialized questions and achie…",2025-06-19 22:24:19+00:00,2025-06-30 19:53:48.731637,Germany,['Python'],
adzuna,de,python developer,Python / Rust Developer for Matrix Synapse Homeserver (m/f/d),Famedly GmbH,"Prenzlauer Berg, Berlin",60000.0,75000.0,"Are you motivated to develop robust and scalable open-source software that drives secure and decentralized communication? If so, the role as a Python / Rust Developer for Matrix Synapse Homeserver (AGPLv3 Open-Source) at Famedly could be the perfect fit for you! Since the foundation in 2019, Famedly has been committed to digitizing medical communication processes in compliance with data protection regulations and thus revolutionizing the healthcare system. Famedly has launched the first gematik…",2025-06-25 22:08:13+00:00,2025-06-30 19:53:48.731643,Germany,['Python'],67500.0
adzuna,de,python developer,"Backend Developer (Python, FastAPI, Django, Postgres)",Wasteer,"Pankow, Berlin",,,"At Wasteer , we are redefining waste management with cutting-edge technology and data-driven solutions. As a part of the venture builder NEEW Ventures , we’re on a mission to transform waste into a resource and accelerate the shift to a circular economy. Are you passionate about building high-performance systems and handling applications designed to scale seamlessly? Join us as a Backend Developer in Berlin and be part of a team dedicated to pushing the boundaries of what’s possible in sustaina…",2025-04-23 03:56:30+00:00,2025-06-30 19:53:48.731650,Germany,['Python'],
adzuna,de,python developer,Software Developer Python (m/w/d),FERCHAU GmbH,"Mitte, Stuttgart",,,"Technologischer Fortschritt gelingt nur, wenn Visionen zur Realität werden. Dazu bringen wir bei FERCHAU als eine der führenden europäischen Plattformen für Technologie-Dienstleistungen die smartesten und innovativsten Köpfe mit Unternehmen verschiedenster Branchen zusammen. Wir suchen dich: als ambitionierte:r Kolleg:in, der:die wie wir Technologien auf die nächste Stufe bringen möchte. Wir realisieren spannende Projekte für namhafte Kunden in allen Technologiebereichen und für alle Branchen u…",2023-11-14 10:22:03+00:00,2025-06-30 19:53:48.731657,Germany,['Python'],
adzuna,de,python developer,Senior Backend Developer * Python/Node.js,NEXT Data Service AG,"Berlin, Deutschland",,,"Du willst skalierbare Backend-Architekturen für eine innovative SaaS-Lösung im Healthcare-Bereich entwickeln und mit einem ambitionierten Team neue Maßstäbe setzen? Dann werde unser neuer Senior Backend Entwickler * (m/w/d) bei der NEXT Data Service AG . Aufgaben Innovation & Impact: Entwickle eine zukunftsweisende Plattform, die die Effizienz in Krankenhäusern steigert und Patientenprozesse optimiert. Flexibilität: Hybrid-Work – arbeite remote und tageweise in unserem Büro in Berlin. Dynamisch…",2025-04-11 21:42:07+00:00,2025-06-30 19:53:48.732021,Germany,"['Python', 'JavaScript', 'Node.js']",
adzuna,de,python developer,Software Developer Python (D/M/W),WEBSALE AG,"Gebersdorf, Nürnberg",40000.0,65000.0,"Deine Aufgaben Konzeption, Entwurf und Implementierung von Web-Appikationen, Schnittstellen, Datenbank- und Real-Time-Anwendungen Optimierung und kontinuierliche Weiterentwicklung unserer E-Commerce Software Arbeiten mit den neuesten Tools, wie ChatGPT, Kubernetes, Docker, VSCode, CoPilot, GitLab Dein Profil Abgeschlossenes Studium (Informatik / technische Studiengänge), Ausbildung als Fachinformatiker oder vergleichbare Erfahrungen / Qualifikationen Leidenschaft für Programmierung und Interess…",2025-02-05 19:06:32+00:00,2025-06-30 19:53:48.732041,Germany,['Python'],52500.0
adzuna,de,python developer,Software Developer Python (D/M/W),Websale Ag,Deutschland,,,"Deine Aufgaben Konzeption, Entwurf und Implementierung von Web-Appikationen, Schnittstellen, Datenbank- und Real-Time-Anwendungen Optimierung und kontinuierliche Weiterentwicklung unserer E-Commerce Software Arbeiten mit den neuesten Tools, wie ChatGPT, Kubernetes, Docker, VSCode, CoPilot, GitLab Dein Profil Abgeschlossenes Studium (Informatik / technische Studiengänge), Ausbildung als Fachinformatiker oder vergleichbare Erfahrungen / Qualifikationen Leidenschaft für Programmierung und Interess…",2025-02-09 13:16:23+00:00,2025-06-30 19:53:48.732048,Germany,['Python'],
adzuna,de,python developer,Freelance Software Developer (Python-Rust) - AI Trainer,Mindrift,Deutschland,,,"At Mindrift , innovation meets opportunity. We believe in using the power of collective intelligence to ethically shape the future of AI. What we do The Mindrift platform connects specialists with AI projects from major tech innovators. Our mission is to unlock the potential of Generative AI by tapping into real-world expertise from across the globe. About the Role GenAI models are improving very quickly, and one of our goals is to make them capable of addressing specialized questions and achie…",2025-06-20 13:39:58+00:00,2025-06-30 19:53:48.732055,Germany,['Python'],
adzuna,de,python developer,(Junior) Software Developer Python (m/w/d),FERCHAU GmbH,"Beiertheim-Bulach, Karlsruhe",,,"Menschen und Technologien zu verbinden, den Perfect Match für unsere Kunden zu gestalten, immer die richtigen Expert:innen für die jeweilige Herausforderung zu finden - das ist unser Anspruch bei FERCHAU und dafür suchen wir dich: als ambitionierte:r Kolleg:in, der:die wie wir Technologien auf die nächste Stufe bringen möchte. Wir realisieren spannende Projekte für namhafte Kunden in allen Technologiebereichen und für alle Branchen und übernehmen Verantwortung für komplexe Entwicklungsprojekte.…",2025-01-01 01:29:26+00:00,2025-06-30 19:53:48.732061,Germany,['Python'],
adzuna,de,python developer,Full Stack Developer (Python) (m/w/d),Akka Technologies,"Haar, München (Kreis)",,,"Entwicklung einer Webapplikation im Bereich „Requirements Engineering“ Implementierung von Schnittstellen für andere Softwarekomponenten Entwicklung von Testfällen in Python Fehleranalyse und –behebung in enger Absprache mit dem Kunden sowie Sicherstellung der Softwarequalität Profile Abgeschlossenes Studium im Bereich der Informatik, Elektrotechnik oder einer vergleichbaren Studienrichtung Fundierte praktische Erfahrungen im Bereich Webapplikationen, Softwaretesting und Automatisierungsprozess…",2023-07-22 08:13:57+00:00,2025-06-30 19:53:48.732158,Germany,['Python'],
adzuna,de,python developer,Senior Full Stack Developer (Python/React/AWS),PMI ADVISORY GMBH,Deutschland,,,"Challenge Werde Teil unseres innovativen Projektteams für Cortex - unseres AI-Agenten für die Investment-Branche. Du entwickelst an einer modernen Full-Stack-Plattform mit Flask  GraphQL, React  TypeScript, Celery, PostgreSQL, MongoDB und einer AWS-Infrastruktur via CDK.Docker Compose vereinfacht das lokale Setup - die Plattform ist auf skalierbare Datenverarbeitung und ML-Workflows ausgelegt. Team Dich erwartet eine spannende Rolle in einem interdisziplinären Team aus CTO, Data Scientist, AWS-…",2025-06-20 23:46:52+00:00,2025-06-30 19:53:48.732165,Germany,"['Python', 'React']",
adzuna,de,python developer,Senior Full Stack Developer (Python/React/AWS),PMI ADVISORY GMBH,"Hamburg, Deutschland",,,"Challenge Werde Teil unseres innovativen Projektteams für Cortex – unseres AI-Agenten für die Investment-Branche. Du entwickelst an einer modernen Full-Stack-Plattform mit Flask  GraphQL, React  TypeScript, Celery, PostgreSQL, MongoDB und einer AWS-Infrastruktur via CDK.Docker Compose vereinfacht das lokale Setup – die Plattform ist auf skalierbare Datenverarbeitung und ML-Workflows ausgelegt. Team Dich erwartet eine spannende Rolle in einem interdisziplinären Team aus CTO, Data Scientist, AWS-…",2025-06-21 02:38:42+00:00,2025-06-30 19:53:48.732169,Germany,"['Python', 'React']",
adzuna,de,javascript developer,Senior JavaScript Developer,Montash,Deutschland,,,"Role: Freelance Senior JavaScript Developer Location: 100% Remote - Germany preffered Contract Type: Freelance / B2B Contract Length: 6 months ( extensions) Start Date: July 2025 Work Schedule: EU or UK candidates considered Interview process: 2 Stage (Including live technical assessment) We’re looking for an experienced Senior JavaScript Developer to join a fully remote, cross-functional team working on a privacy-focused file management platform . In this role, you’ll be responsible for delive…",2025-06-14 09:37:42+00:00,2025-06-30 19:53:51.411332,Germany,['JavaScript'],
adzuna,de,javascript developer,JavaScript-Developer (m/w/d),FERCHAU GmbH,"Böckingen, Heilbronn",,,"Du teilst unsere Leidenschaft für Innovationen und Technologien und willst dich den Herausforderungen der Zukunft stellen? Dann komm zu FERCHAU: als ambitionierte:r Kolleg:in, der:die wie wir Technologien auf die nächste Stufe bringen möchte. Wir realisieren spannende Projekte für namhafte Anbieter und Entwickler von IT-Lösungen für smarte Integration von IT-Trends und etablierter Lösungen. Als Berufserfahrene:r oder Berufseinsteiger:in unterstützt du deine Kolleg:innen mit deinem langjährigen …",2023-11-14 10:21:39+00:00,2025-06-30 19:53:51.411349,Germany,['JavaScript'],
adzuna,de,javascript developer,JavaScript Developer:in (m/w/d),land in sicht AG,"Freiburg (Elbe), Stade (Kreis)",,,"Das ist land in sicht Wir entwickeln digitale Lösungen für den Tourismus – dafür suchen wir zum nächstmöglichen Zeitpunkt Unterstützung im Bereich Technische Entwicklung in unserem Büro in Freiburg. Wenn du Lust hast, innovative Produkte mitzugestalten, Verantwortung zu übernehmen und gemeinsam im Team etwas zu bewegen – dann freuen wir uns auf dich! Deine Aufgaben Du entwickelst neue Features auf Basis technischer Konzepte und Designs in Vue.js Du sorgst für eine optimale User Experience , dur…",2025-06-08 14:33:30+00:00,2025-06-30 19:53:51.411353,Germany,['JavaScript'],
adzuna,de,javascript developer,JavaScript Developer (m/w/d),denkwerk,"Ehrenfeld, Köln",,,"Wer uns fehlt, bist du! Wir suchen dich, mit Leidenschaft fürs Software-Development und Interesse, dich rund um das Thema JavaScript stetig weiterzuentwickeln Gemeinsam mit unserem Frontend-Development und UX / UI Design setzt du verschiedenste Soft- und Web-Projekte um Du bringst mehrjährige Erfahrung in der Entwicklung von JavaScript- oder TypeScript-Applikationen mit React, Vue oder Angular sind dir als Frameworks bekannt und du bist in der Lage, die richtigen Technologien für die Umsetzung …",2025-05-30 14:39:04+00:00,2025-06-30 19:53:51.411357,Germany,['JavaScript'],
adzuna,de,javascript developer,JavaScript - Senior Developer (f/m/d),HCLTech Germany,Deutschland,,,"JavaScript - Senior Developer (f/m/d) We are HCLTech, one of the fastest-growing large tech companies in the world and home to 225,000 people across 60 countries, supercharging progress through industry-leading capabilities centered around Digital, Engineering and Cloud. The driving force behind that work, our people, are diverse, creative, and passionate, raising the bar for excellence on a regular basis. We, in turn, work hard to bring out the best in them as we strive to help them find their…",2025-06-27 08:24:09+00:00,2025-06-30 19:53:51.411360,Germany,['JavaScript'],
adzuna,de,javascript developer,C#/JavaScript Developer (m/w/d),Peak One GmbH,"Region Hannover (Kreis), Niedersachsen",70000.0,90000.0,"Unser Kunde ist ein mittelständisches, inhaber­geführtes Technologie­unternehmen, das seit mehr als 25 Jahren hoch­innovative Automatisierungs- und Prozess­leit­systeme für Kunden aus den Branchen Produktion, Logistik und Energie entwickelt. Das Entwicklungs­team vereint modernste Software­technologien mit exzellenter Domänen­expertise und gestaltet Industrie‑4.0‑Lösungen, die international Maßstäbe setzen. Zur weiteren Verstärkung suchen wir Sie als C#/JavaScript Entwickler (m/w/d). Ihre Aufga…",2025-06-17 16:19:18+00:00,2025-06-30 19:53:51.411364,Germany,['JavaScript'],80000.0
adzuna,de,javascript developer,Angular Software Developer - JavaScript / Golang (m/w/d),Swarco AG,Deutschland,,,"Ihre Aufgaben Die Entwicklung von benutzerfreundlichen Inbetriebnahme- und Service-Tools für unsere intelligenten Verkehrssysteme liegt in Ihrem Verantwortungsbereich Benutzeroberflächen gestalten Sie funktional und CI-konform – stets mit Blick auf den Bedarf von Markt und Serviceteams Ihre Arbeit dokumentieren Sie strukturiert und begleiten die Integration in Produkte, Steuergeräte und Systeme im Bereich CCAM/C-ITS Anforderungen analysieren Sie methodisch und setzen diese im Rahmen unserer agi…",2025-06-27 22:00:21+00:00,2025-06-30 19:53:51.411367,Germany,['JavaScript'],
adzuna,de,javascript developer,Senior Javascript Developer (f/m/d),sqanit GmbH,"Au-Haidhausen, München",,,"sqanit is a Munich-based SaaS company pioneering in Product Lifecycle Experience (PLX), dedicated to empowering businesses to unlock the full potential of their physical products' lifecycles through advanced Digital Product Passport (DPP) solutions. Our platform not only enables companies to maximize total lifetime value by delivering seamless service and aftermarket experiences but also ensures compliance with essential regulations. By aligning with standards like the European Ecodesign for Su…",2025-05-28 12:59:40+00:00,2025-06-30 19:53:51.411370,Germany,['JavaScript'],
adzuna,de,javascript developer,Software Developer AWS JavaScript / Cloud (d/m/w),Haufe Group SE,"Freiburg im Breisgau, Baden-Württemberg",,,"Freiburg im Breisgau ab sofort Für unser Team ""FBL Planung & Organisation"" im Geschäftsbereich Business Technology L&D suchen wir zum nächstmöglichen Termin am Standort Freiburg im Breisgau eine/n Software Engineer AWS & TypeScript (d/m/w) – Event-Driven Architectures. DAS ERWARTET DICH: Du bist Teil eines agilen Scrum-Teams und verantwortest gemeinsam mit dem Team Konzeption, Entwicklung und Betrieb unserer Anwendungen Du konzipierst und entwickelst neue Services in einer vollständig auf TypeS…",2025-06-19 03:40:38+00:00,2025-06-30 19:53:51.411373,Germany,['JavaScript'],
adzuna,de,javascript developer,Java / JavaScript Developer / Software Entwickler (m/w/d),ECS Engineering Consulting & Solutions GmbH,"Neumarkt in der Oberpfalz, Neumarkt in der Oberpfalz (Kreis)",,,"Die ECS GmbH ist heute einer der führenden Spezialisten für PLM, CAx, IoT und digitale Transformation. Wir sehen uns als Wegbereiter und -begleiter für die Digitalisierung und Optimierung komplexer Geschäftsprozesse und Produktlebenszyklen. Gemeinsam wachsen und sich entwickeln in einer familiären Arbeitsumgebung, die neben den notwendigen kreativen Freiräumen auch die persönlichen Wünsche respektiert, dafür stehen wir seit über 25 Jahren. Java / JavaScript Developer / Software Entwickler (m/w/…",2023-12-01 10:34:17+00:00,2025-06-30 19:53:51.411376,Germany,['JavaScript'],
adzuna,de,javascript developer,JavaScript (React) Developer,Vistex Career,"Walldorf, Rhein-Neckar-Kreis",,,"Vistex is growing and we are looking for JavaScript Developers with React that are motivated individuals who are eager to learn and combine the art of design with the art of programming. These individual will be key contributors to numerous projects and development of cutting edge technology and experiences for our clients. Currently, we’re looking to expand our team in Walldorf with a new colleague who brings over 4 years of experience working with JavaScript, React, and TypeScript, and is ope…",2025-04-12 22:28:58+00:00,2025-06-30 19:53:51.411379,Germany,"['JavaScript', 'React']",
adzuna,de,javascript developer,Software Developer Java / JavaScript (m/w/d),ISR Information Products AG,"Münster, Nordrhein-Westfalen",,,"Dein Team Buildsimple ist unsere KI-basierte Software zur intelligenten Dokumentenverarbeitung und wird seit 2017 in Münster entwickelt. Unser Ziel ist es, die Vorteile von künstlicher Intelligenz durch unsere Software-as-a-Service Lösung allen Kunden einfach und schnell zugänglich zu machen. Unser hoch spezialisiertes Team ist es gewohnt, mit großen Unternehmen zusammenzuarbeiten und dabei selbst eine Startup-Philosophie zu leben. Was dich erwartet Du gibst Impulse für die Weiterentwicklung un…",2025-06-20 19:28:03+00:00,2025-06-30 19:53:51.411383,Germany,['JavaScript'],
adzuna,de,javascript developer,Senior Software Developer AWS JavaScript / Cloud (d/m/w),Haufe Group SE,"Freiburg im Breisgau, Baden-Württemberg",,,"Freiburg im Breisgau ab sofort Für unser Team ""Business Technology L&D"" suchen wir zum nächstmöglichen Termin am Standort Freiburg im Breisgau eine/n Senior Software Engineer AWS Typescript (d/m/w). DAS ERWARTET DICH: Du entwickelst innovative Lösungen für unsere Business Plattform in der AWS Cloud Du bist Teil eines Scrum-Teams und verantwortest gemeinsam im Dev-Team Konzeption, Umsetzung und Betrieb Du beschäftigst dich mit modernen Architekturprinzipien, neuen Technologien und hilfst uns dab…",2025-05-13 20:55:04+00:00,2025-06-30 19:53:51.411386,Germany,['JavaScript'],
adzuna,de,javascript developer,Informatiker als Software Developer Java / Javascript (m/w/d),ISR Information Products AG,"Braunschweig, Niedersachsen",,,"Dein Team Dein Team besteht aus sympathischen Entwickler:innen und Berater:innen, die für unsere Kunden unterschiedlicher Branche in Enterprise-Projekten arbeiten. Als Entwickler:in setzt du kundenindividuelle Entwicklungen in Java bzw. JavaScript um. Du passt am besten zu uns, wenn du eine eigenverantwortliche und strukturierte Arbeitsweise besitzt. Und worauf darfst du dich freuen? Auf ein harmonisches Miteinander, einen starken Zusammenhalt und jede Menge Humor bei der Arbeit. Was dich erwar…",2025-06-20 19:27:56+00:00,2025-06-30 19:53:51.411389,Germany,['JavaScript'],
adzuna,de,javascript developer,Informatiker als Software Developer Java / Javascript (m/w/d),ISR Information Products AG,"Münster, Nordrhein-Westfalen",,,"Dein Team Dein Team besteht aus sympathischen Entwickler:innen und Berater:innen, die für unsere Kunden unterschiedlicher Branche in Enterprise-Projekten arbeiten. Als Entwickler:in setzt du kundenindividuelle Entwicklungen in Java bzw. JavaScript um. Du passt am besten zu uns, wenn du eine eigenverantwortliche und strukturierte Arbeitsweise besitzt. Und worauf darfst du dich freuen? Auf ein harmonisches Miteinander, einen starken Zusammenhalt und jede Menge Humor bei der Arbeit. Was dich erwar…",2025-06-20 19:43:59+00:00,2025-06-30 19:53:51.411393,Germany,['JavaScript'],
adzuna,de,javascript developer,Informatiker als Software Developer Java / Javascript (m/w/d),ISR Information Products AG,"Köln, Nordrhein-Westfalen",,,"Dein Team Dein Team besteht aus sympathischen Entwickler:innen und Berater:innen, die für unsere Kunden unterschiedlicher Branche in Enterprise-Projekten arbeiten. Als Entwickler:in setzt du kundenindividuelle Entwicklungen in Java bzw. JavaScript um. Du passt am besten zu uns, wenn du eine eigenverantwortliche und strukturierte Arbeitsweise besitzt. Und worauf darfst du dich freuen? Auf ein harmonisches Miteinander, einen starken Zusammenhalt und jede Menge Humor bei der Arbeit. Was dich erwar…",2025-06-20 19:39:16+00:00,2025-06-30 19:53:51.411396,Germany,['JavaScript'],
adzuna,de,javascript developer,Fullstack Software Developer Java / JavaScript (m/w/d),ISR Information Products AG,"Münster, Nordrhein-Westfalen",,,"Dein Team Buildsimple ist unsere KI-basierte Software zur intelligenten Dokumentenverarbeitung und wird seit 2017 in Münster entwickelt. Unser Ziel ist es, die Vorteile von künstlicher Intelligenz durch unsere Software-as-a-Service Lösung allen Kunden einfach und schnell zugänglich zu machen. Unser hoch spezialisiertes Team ist es gewohnt, mit großen Unternehmen zusammenzuarbeiten und dabei selbst eine Startup-Philosophie zu leben. Was dich erwartet Du gibst Impulse für die Weiterentwicklung un…",2025-06-20 19:43:54+00:00,2025-06-30 19:53:51.411399,Germany,['JavaScript'],
