source,country,query,title,company,location,salary_min,salary_max,description,created,scraped_at,country_name,skills,salary_avg
adzuna,es,javascript developer,WEB Developer - Platform (ODS),Banco Santander,España,,,"WEB Developer - Platform (ODS) Country: Spain Software Engineering Sr Analyst Open Digital Services is the software development company of Santander Group powering the next generation of banks by creating innovative banking products and implementing them in collaboration with Santander Group Affiliates. Santander Group is one of the world's largest financial institutions and the Eurozone's leader, we're committed to being the best Digital Bank with Branches in the industry. Our mission at ODS i…",2025-06-23 13:23:25+00:00,2025-06-30 19:54:06.644898,Spain,[],
adzuna,es,javascript developer,Angular - Senior Frontend Engineer,Celonis,España,,,"We're Celonis, the global leader in Process Mining technology and one of the world's fastest-growing SaaS firms. We believe there is a massive opportunity to unlock productivity by placing data and intelligence at the core of business processes - and for that, we need you to join us. The Team: At Celonis Process Management team, we are looking for a colleague to join our team of FE developers. This team is based in Madrid in Our Tech Hub in Azca, Madrid The team goal is to build web application…",2025-02-16 11:51:53+00:00,2025-06-30 19:54:06.644903,Spain,[],
adzuna,es,javascript developer,Angular - Senior Frontend Engineer,Celonis,Madrid,,,"We're Celonis, the global leader in Process Mining technology and one of the world's fastest-growing SaaS firms. We believe there is a massive opportunity to unlock productivity by placing data and intelligence at the core of business processes - and for that, we need you to join us. The Team: At Celonis Process Management team, we are looking for a colleague to join our team of FE developers. This team is based in Madrid in Our Tech Hub in Azca, Madrid The team goal is to build web application…",2025-02-12 21:05:42+00:00,2025-06-30 19:54:06.644909,Spain,[],
adzuna,es,javascript developer,Customer Success Engineer - Spain,Quantum Metric,Madrid,,," Our Culture Quantum Metric's number one objective is happy people, diverse and inclusive culture. We’re passionate about empowering our people to become the best version of themselves, offering coaching and training programs designed to accelerate their career in whatever direction they choose. As a remote-first company, we understand the importance of building an engaged, diverse, and fun place to work. We hold regular company-wide events, seasonal challenges, and Quantum Metric sponsored loc…",2025-05-14 12:58:36+00:00,2025-06-30 19:54:06.644913,Spain,[],
adzuna,es,javascript developer,Software Developer,Geotab,España,,,"Who we are: Geotab ® is a global leader in IoT and connected transportation and certified “Great Place to Work™.” We are a company of diverse and talented individuals who work together to help businesses grow and succeed, and increase the safety and sustainability of our communities. Geotab is advancing security, connecting commercial vehicles to the internet and providing web-based analytics to help customers better manage their fleets. Geotab’s open platform and Geotab Marketplace ®, offering…",2025-05-20 13:06:13+00:00,2025-06-30 19:54:06.644917,Spain,[],
adzuna,es,javascript developer,"Lead/Senior Software Engineer, Client Platform",Rover.com,Barcelona,,,"Who we are: Want to make an impact? Join our pack and come work (and play) with us. We believe everyone deserves the unconditional love of a pet—and at Rover, our mission is to make it easier to experience that love. Founded in 2011, the Rover app and website connect dog and cat parents with loving pet sitters and dog walkers in neighborhoods across the US, Canada, and Europe. We empower our community of trusted pet sitters and dog walkers to run their own pet care businesses on Rover with the …",2025-02-25 11:55:18+00:00,2025-06-30 19:54:06.644923,Spain,[],
adzuna,es,javascript developer,"Senior Software Engineer, Client Platform","A Place for Rover, Inc.","Barcelona, Cataluña",70000.0,90000.0,"Who we are: Want to make an impact? Join our pack and come work (and play!) with us. We believe everyone deserves the unconditional love of a pet—and at Rover, our mission is to make it easier to experience that love. Founded in 2011, the Rover app and website connect dog and cat parents with loving pet sitters and dog walkers in neighborhoods across the US, Canada, and Europe. We empower our community of trusted pet sitters and dog walkers to run their own pet care businesses on Rover with the…",2025-03-31 18:39:16+00:00,2025-06-30 19:54:06.644928,Spain,[],80000.0
adzuna,es,react developer,React Developer,PrimeIT España,España,,,"¿Estás preparado para un cambio y explotar tus habilidades como nunca?  Sigue leyendo porque tenemos lo que buscas…  ¿ Quiénes somos?  Somos una empresa internacional con más de 18 años de experiencia en consultoría e ingeniería informática. Con más de 3000 Primers operando en 4 sectores principales en todo el mundo: IT, Telecomunicaciones, Energía e Infraestructuras Nos puedes encontrar en más de 50 ciudades en todo el mundo: ESPAÑA | PORTUGAL | FRANCIA | REINO UNIDO | ITALIA | SUIZA | POLONIA…",2025-06-13 12:13:42+00:00,2025-06-30 19:54:09.308489,Spain,['React'],
adzuna,es,react developer,React Developer,Plexus Tech,España,,,"Somos Plexus Tech. Una compañía tecnológica especializada en servicios y productos IT, basados en la innovación y el desarrollo. Fundada en el talento y las capacidades de nuestra gente, más de 2.800 profesionales desarrollan tecnología con alma para que organismos públicos, compañías del IBEX 35, grandes retailers, operadores turísticos y entidades financieras crezcan con nosotros. Si lo que buscas es trabajar con las tecnologías más punteras del mercado y seguir progresando profesionalmente, …",2025-06-17 14:21:51+00:00,2025-06-30 19:54:09.308605,Spain,['React'],
adzuna,es,react developer,React Developer,Wizeline,España,,,"The Company Wizeline is a global digital services company helping mid-size to Fortune 500 companies build, scale, and deliver high-quality digital products and services. We thrive in solving our customers’ challenges through human-centered experiences, digital core modernization, and intelligence everywhere (AI/ML and data). We help them succeed in building digital capabilities that bring technology to the core of their business. Are You a Fit? Sounds awesome, right? Now, let’s make sure you’re…",2025-06-22 12:21:20+00:00,2025-06-30 19:54:09.308612,Spain,['React'],
adzuna,es,react developer,React Developer,Profile Software Services,España,,,"Desde Profile nos encontramos en búsqueda de un perfil técnico con experiencia en: Desarrollo de componentes y aplicaciones con ReactJS TypeScript avanzado Redux y React Hook Testing con Vitest Estilado con Tailwind CSS Validación de esquemas con ZOD Uso de Postman Trabajo con diseños desde Figma (UX) ✨ Valorable: Compilación con TurboJS y trabajo en monorepos Uso de PNPM como gestor de paquetes Frameworks de internacionalización Experiencia con Sonar , Fortify y Nexus  Inglés : Nivel mínimo B2…",2025-06-17 13:55:35+00:00,2025-06-30 19:54:09.308616,Spain,['React'],
adzuna,es,react developer,React Developer,PrimeIT España,Barcelona,,,"¿Estás preparado para un cambio y explotar tus habilidades como nunca?  Sigue leyendo porque tenemos lo que buscas…  ¿ Quiénes somos?  Somos una empresa internacional con más de 18 años de experiencia en consultoría e ingeniería informática. Con más de 3000 Primers operando en 4 sectores principales en todo el mundo: IT, Telecomunicaciones, Energía e Infraestructuras Nos puedes encontrar en más de 50 ciudades en todo el mundo: ESPAÑA | PORTUGAL | FRANCIA | REINO UNIDO | ITALIA | SUIZA | POLONIA…",2025-06-13 12:13:00+00:00,2025-06-30 19:54:09.308619,Spain,['React'],
adzuna,es,react developer,Senior React Developer,Capitole,España,,,"At CAPITOLE , we keep growing and want to do it with you! We are looking for a React/Redux Developer with 4 years of experience in building scalable and high-performance web applications. The ideal candidate should have a strong command of React.js , Redux , and React Hooks , and be motivated to contribute to a dynamic team. Full remote, but preferably Barcelona.  What profile are we looking for? Development and maintenance of web applications using React.js, Redux, and React Hooks. Design and …",2025-06-27 14:49:02+00:00,2025-06-30 19:54:09.308622,Spain,['React'],
adzuna,es,react developer,Senior React Developer,Unimedia Technology,España,,,"At Unimedia Technology we are looking for a Senior React Engineer. The candidate will join a growing development team within an exciting Global Digital signage platform. You must have a good attention to detail, analisis skills and pride to achive the best Quality products. This is a Full Time Job working in a hybrid setting 3 days office and 2 from home. Required Skills 4 years as Web Developer 2 years of recent React experience Good understanding of HTML5 and CSS3. Good spoken english skills …",2025-06-21 11:39:55+00:00,2025-06-30 19:54:09.308626,Spain,['React'],
adzuna,es,react developer,React Developer - Remote,E-Frontiers,España,,,"Desde E-Frontiers estamos buscando programadores React para formar parte de una empresa de un empresa en plena expansión internacional. Somos una agencia de reclutamiento especializada en perfiles IT de origen Irlandés, con presencia en España desde hace 10 años. La contratación será directamente con el cliente y te estaremos dando acompañamiento durante todo el proceso de selección. Trabajamos con diferentes clientes desde Start-Ups hasta multinacionales. Tareas: Desarrollo web con React, Type…",2025-05-22 04:29:51+00:00,2025-06-30 19:54:09.308629,Spain,['React'],
adzuna,es,react developer,React Developer - 100% Remoto,ISPROX,España,,,"¿Estás buscando nuevos retos?  Te incorporarás en una empresa de consultoría tecnológica realizando las siguientes funciones : Desarrollar e implementar nuevas funcionalidades utilizando React y TypeScript. Participar activamente en el diseño técnico y toma de decisiones de arquitectura frontend. Optimizar el rendimiento de las aplicaciones en distintos entornos. Gestionar dependencias y scripts a través de NPM, garantizando buenas prácticas y mantenimiento sostenible del código. Colaborar en e…",2025-06-27 14:49:05+00:00,2025-06-30 19:54:09.308632,Spain,['React'],
adzuna,es,react developer,Fullstack .Net / React Developer,Capitole,España,,,"¡En CAPITOLE, seguimos creciendo y queremos hacerlo contigo! Estamos buscando un Desarrollador Fullstack con amplia experiencia en React y .Net, especializado en la creación de aplicaciones web escalables y de alto rendimiento, para trabajar en proyectos innovadores para una empresa líder a nivel global en la creación, producción y gestión de contenidos audiovisuales.  ¿Qué perfil estamos buscando? Desarrollo y mantenimiento de aplicaciones web utilizando React.js y .Net . Crear y gestionar el …",2025-06-27 14:32:04+00:00,2025-06-30 19:54:09.308635,Spain,['React'],
adzuna,es,react developer,React Developer (m/f/d),Quantion,España,,,"Who we are Quantion is a Business Digital Transformation services company born in 2015. We have 120 professionals in application development, UX/UI and digital business transformation to build innovative solutions oriented to business results. We combine our teams in cutting-edge technologies and digital deep experiences with the innovation ecosystem, to ensure that we can provide the best solution to face business challenges, from its concept to its implementation. We are looking for a React d…",2025-06-06 13:38:15+00:00,2025-06-30 19:54:09.308639,Spain,['React'],
adzuna,es,react developer,React Developer - Power BI Experience,Wizeline,España,,,"The Company Wizeline is a global digital services company helping mid-size to Fortune 500 companies build, scale, and deliver high-quality digital products and services. We thrive in solving our customers’ challenges through human-centered experiences, digital core modernization, and intelligence everywhere (AI/ML and data). We help them succeed in building digital capabilities that bring technology to the core of their business. Are You a Fit? Sounds awesome, right? Now, let’s make sure you’re…",2025-06-01 04:12:33+00:00,2025-06-30 19:54:09.308642,Spain,['React'],
adzuna,es,react developer,React senior Developer,Plexus Tech,España,,,"¡Únete a Plexus Tech y Desarrolla Tecnología con Alma! Somos Plexus Tech , una compañía tecnológica líder en servicios y productos IT, impulsada por el talento y las capacidades de más de 4000 profesionales. ¿Eres un/a Programador/a React? ¿Te entusiasma trabajar en proyectos innovadores que abarcan desde el backend hasta el frontend? estamos buscamos un react Developer para unirse a nuestro equipo. ¿Qué buscamos? Experiencia como programador React de al menos 5 años y experiencia en Python par…",2025-06-21 11:40:20+00:00,2025-06-30 19:54:09.308645,Spain,['React'],
adzuna,es,react developer,React Developer,Plexus,Madrid,,,"React Developer Join Plexus Tech. Were looking for React developers with at least 5 years of experience in native development. Requirements: - More than 5 years of continuous and specialized experience in React development (latest versions of React, 16 and 18). - Experience in JS - Experience in Typescript (Generics, etc.) - Unit testing with the React Testing Library (JEST) - Proficiency in CSS (Styled Components) - Nice to have: Knowledge of OOP (Object-Oriented Programming) - Knowledge of Do…",2025-06-24 20:40:26+00:00,2025-06-30 19:54:09.308648,Spain,['React'],
adzuna,es,react developer,React Developer,Inneva Pharma,"Álava, País Vasco",,,"Desde HAYS estamos colaborando con una empresa especializada en servicios financieros y tecnológicos con sede principal en Irún. Estamos en búsqueda de un React Developer, para incorporarse dentro del departamento de IT. ¿QUÉ BUSCAMOS? Experiencia mínima de 2 años en puestos similares. Importante experiencia con React Valorable experiencia y dominio en .NET Core, C#, NET Framework, ASP .NET MVC Experiencia con Serialización XML, JSON e implementación de servicios web REST (cliente y servidor) E…",2025-06-28 23:28:06+00:00,2025-06-30 19:54:09.308651,Spain,['React'],
adzuna,es,react developer,React Developer,Inneva Pharma,"Das, Girona",,,"Desde HAYS estamos colaborando con una empresa especializada en servicios financieros y tecnológicos con sede principal en Irún. Estamos en búsqueda de un React Developer, para incorporarse dentro del departamento de IT. ¿QUÉ BUSCAMOS? Experiencia mínima de 2 años en puestos similares. Importante experiencia con React Valorable experiencia y dominio en .NET Core, C#, NET Framework, ASP .NET MVC Experiencia con Serialización XML, JSON e implementación de servicios web REST (cliente y servidor) E…",2025-06-27 23:22:42+00:00,2025-06-30 19:54:09.308654,Spain,['React'],
adzuna,es,react developer,React Developer,Flat101,España,,,"DESCRIPCIóN ¿Eres un apasionado/a del Front? ¿Quieres trabajar en los mejores proyectos y con el mejor equipo? Entonces… Eres la persona que andamos buscando. En Flat 101 necesitamos ampliar nuestro equipo de desarrollo y buscamos un/a React Developer y tú puedes formar parte de este gran equipazo. ¿Qué es Flat 101? Flat 101 es la empresa española de referencia en optimización (CRO/CXO/BXO, diseño y desarrollo de productos y servicios digitales. Prestamos servicios de alto rendimiento digital o…",2025-06-23 14:49:15+00:00,2025-06-30 19:54:09.308657,Spain,['React'],
adzuna,es,react developer,React Developer,Abbott,Barcelona,,,"At Abbott, we believe people with diabetes should be empowered to enjoy healthy and happy lives. That's why we're focused on helping people with diabetes manage their health more effectively and comfortably, with life-changing products that provide accurate data to drive better-informed decisions. We're revolutionizing the way people monitor their glucose levels with our new sensing technology. Interested in applying your wealth of technical knowledge and experience towards an opportunity in th…",2025-05-14 22:31:28+00:00,2025-06-30 19:54:09.308661,Spain,['React'],
adzuna,es,react developer,React developer – Spain,E-Frontiers,España,,,"Desde E-Frontiers estamos buscando programadores React para formar parte de una empresa de un empresa en plena expansión internacional. Somos una agencia de reclutamiento especializada en perfiles IT de origen Irlandés, con presencia en España desde hace 10 años. La contratación será directamente con el cliente y te estaremos dando acompañamiento durante todo el proceso de selección. Trabajamos con diferentes clientes desde Start-Ups hasta multinacionales. Tareas: Desarrollo web con React, Type…",2025-06-27 03:13:34+00:00,2025-06-30 19:54:09.308664,Spain,['React'],
adzuna,es,react developer,React Developer - Remote,E-Frontiers,Tarragona,,,"Desde E-Frontiers estamos buscando programadores React para formar parte de una empresa de un empresa en plena expansión internacional.Somos una agencia de reclutamiento especializada en perfiles IT de origen Irlandés, con presencia en España desde hace 10 años. La contratación será directamente con el cliente y te estaremos dando acompañamiento durante todo el proceso de selección. Trabajamos con diferentes clientes desde Start-Ups hasta multinacionales.Test con Jest y react-testing-library.Me…",2025-06-29 23:23:03+00:00,2025-06-30 19:54:09.308667,Spain,['React'],
adzuna,es,react developer,React Developer - Remote,E-Frontiers,A Coruña,,,"Desde E-Frontiers estamos buscando programadores React para formar parte de una empresa de un empresa en plena expansión internacional.Somos una agencia de reclutamiento especializada en perfiles IT de origen Irlandés, con presencia en España desde hace 10 años. La contratación será directamente con el cliente y te estaremos dando acompañamiento durante todo el proceso de selección. Trabajamos con diferentes clientes desde Start-Ups hasta multinacionales.Test con Jest y react-testing-library.Me…",2025-06-29 23:23:04+00:00,2025-06-30 19:54:09.308670,Spain,['React'],
adzuna,es,react developer,React Developer - Remote,E-Frontiers,Badajoz,,,"Desde E-Frontiers estamos buscando programadores React para formar parte de una empresa de un empresa en plena expansión internacional.Somos una agencia de reclutamiento especializada en perfiles IT de origen Irlandés, con presencia en España desde hace 10 años. La contratación será directamente con el cliente y te estaremos dando acompañamiento durante todo el proceso de selección. Trabajamos con diferentes clientes desde Start-Ups hasta multinacionales.Test con Jest y react-testing-library.Me…",2025-06-29 23:23:02+00:00,2025-06-30 19:54:09.308673,Spain,['React'],
adzuna,es,react developer,React Developer - Remote,E-Frontiers,"Alicante, Comunidad Valenciana",,,"Desde E-Frontiers estamos buscando programadores React para formar parte de una empresa de un empresa en plena expansión internacional.Somos una agencia de reclutamiento especializada en perfiles IT de origen Irlandés, con presencia en España desde hace 10 años. La contratación será directamente con el cliente y te estaremos dando acompañamiento durante todo el proceso de selección. Trabajamos con diferentes clientes desde Start-Ups hasta multinacionales.Test con Jest y react-testing-library.Me…",2025-06-29 23:23:05+00:00,2025-06-30 19:54:09.308676,Spain,['React'],
adzuna,es,react developer,React Developer - Remote,E-Frontiers,Almería,,,"Desde E-Frontiers estamos buscando programadores React para formar parte de una empresa de un empresa en plena expansión internacional.Somos una agencia de reclutamiento especializada en perfiles IT de origen Irlandés, con presencia en España desde hace 10 años. La contratación será directamente con el cliente y te estaremos dando acompañamiento durante todo el proceso de selección. Trabajamos con diferentes clientes desde Start-Ups hasta multinacionales.Test con Jest y react-testing-library.Me…",2025-06-29 23:23:09+00:00,2025-06-30 19:54:09.308680,Spain,['React'],
adzuna,es,react developer,React Developer - Remote,E-Frontiers,"Álava, País Vasco",,,"Desde E-Frontiers estamos buscando programadores React para formar parte de una empresa de un empresa en plena expansión internacional.Somos una agencia de reclutamiento especializada en perfiles IT de origen Irlandés, con presencia en España desde hace 10 años. La contratación será directamente con el cliente y te estaremos dando acompañamiento durante todo el proceso de selección. Trabajamos con diferentes clientes desde Start-Ups hasta multinacionales.Test con Jest y react-testing-library.Me…",2025-06-29 23:23:18+00:00,2025-06-30 19:54:09.308683,Spain,['React'],
adzuna,es,react developer,React Developer - Remote,E-Frontiers,Huelva,,,"Desde E-Frontiers estamos buscando programadores React para formar parte de una empresa de un empresa en plena expansión internacional.Somos una agencia de reclutamiento especializada en perfiles IT de origen Irlandés, con presencia en España desde hace 10 años. La contratación será directamente con el cliente y te estaremos dando acompañamiento durante todo el proceso de selección. Trabajamos con diferentes clientes desde Start-Ups hasta multinacionales.Test con Jest y react-testing-library.Me…",2025-06-29 23:23:20+00:00,2025-06-30 19:54:09.308686,Spain,['React'],
adzuna,es,react developer,React Developer - Remote,E-Frontiers,Jaén,,,"Desde E-Frontiers estamos buscando programadores React para formar parte de una empresa de un empresa en plena expansión internacional.Somos una agencia de reclutamiento especializada en perfiles IT de origen Irlandés, con presencia en España desde hace 10 años. La contratación será directamente con el cliente y te estaremos dando acompañamiento durante todo el proceso de selección. Trabajamos con diferentes clientes desde Start-Ups hasta multinacionales.Test con Jest y react-testing-library.Me…",2025-06-29 23:23:21+00:00,2025-06-30 19:54:09.308689,Spain,['React'],
adzuna,es,react developer,React Developer - Remote,E-Frontiers,Santa Cruz de Tenerife,,,"Desde E-Frontiers estamos buscando programadores React para formar parte de una empresa de un empresa en plena expansión internacional.Somos una agencia de reclutamiento especializada en perfiles IT de origen Irlandés, con presencia en España desde hace 10 años. La contratación será directamente con el cliente y te estaremos dando acompañamiento durante todo el proceso de selección. Trabajamos con diferentes clientes desde Start-Ups hasta multinacionales.Test con Jest y react-testing-library.Me…",2025-06-29 23:23:27+00:00,2025-06-30 19:54:09.308692,Spain,['React'],
adzuna,es,react developer,React Developer - Remote,E-Frontiers,Zaragoza,,,"Desde E-Frontiers estamos buscando programadores React para formar parte de una empresa de un empresa en plena expansión internacional.Somos una agencia de reclutamiento especializada en perfiles IT de origen Irlandés, con presencia en España desde hace 10 años. La contratación será directamente con el cliente y te estaremos dando acompañamiento durante todo el proceso de selección. Trabajamos con diferentes clientes desde Start-Ups hasta multinacionales.Test con Jest y react-testing-library.Me…",2025-06-29 23:23:02+00:00,2025-06-30 19:54:09.308695,Spain,['React'],
adzuna,es,react developer,React Developer - Remote,E-Frontiers,España,,,"Desde E-Frontiers estamos buscando programadores React para formar parte de una empresa de un empresa en plena expansión internacional.Somos una agencia de reclutamiento especializada en perfiles IT de origen Irlandés, con presencia en España desde hace 10 años. La contratación será directamente con el cliente y te estaremos dando acompañamiento durante todo el proceso de selección. Trabajamos con diferentes clientes desde Start-Ups hasta multinacionales.Test con Jest y react-testing-library.Me…",2025-06-29 23:23:02+00:00,2025-06-30 19:54:09.308698,Spain,['React'],
adzuna,es,react developer,React Developer - Remote,E-Frontiers,"Torrejón de Ardoz, Madrid",,,"Desde E-Frontiers estamos buscando programadores React para formar parte de una empresa de un empresa en plena expansión internacional.Somos una agencia de reclutamiento especializada en perfiles IT de origen Irlandés, con presencia en España desde hace 10 años. La contratación será directamente con el cliente y te estaremos dando acompañamiento durante todo el proceso de selección. Trabajamos con diferentes clientes desde Start-Ups hasta multinacionales.Test con Jest y react-testing-library.Me…",2025-06-29 23:23:06+00:00,2025-06-30 19:54:09.308701,Spain,['React'],
adzuna,es,react developer,React Developer - Remote,E-Frontiers,"Leganés, Madrid",,,"Desde E-Frontiers estamos buscando programadores React para formar parte de una empresa de un empresa en plena expansión internacional.Somos una agencia de reclutamiento especializada en perfiles IT de origen Irlandés, con presencia en España desde hace 10 años. La contratación será directamente con el cliente y te estaremos dando acompañamiento durante todo el proceso de selección. Trabajamos con diferentes clientes desde Start-Ups hasta multinacionales.Test con Jest y react-testing-library.Me…",2025-06-29 23:23:09+00:00,2025-06-30 19:54:09.308704,Spain,['React'],
